{
  "schemaVersion": "1.0.0",
  "characterId": "stickman-reference",
  "displayName": "Minimal Stickman Articulation Reference",
  "rigLayoutFile": "rig-layout.json",
  "requiredParts": [
    "root",
    "pelvis",
    "torso",
    "head",
    "upper-arm-left",
    "lower-arm-left",
    "hand-left",
    "upper-arm-right",
    "lower-arm-right",
    "hand-right",
    "thigh-left",
    "shin-left",
    "foot-left",
    "thigh-right",
    "shin-right",
    "foot-right"
  ],
  "requiredAnimationTargets": [
    "root",
    "pelvis",
    "torso",
    "head",
    "shoulder-left",
    "elbow-left",
    "wrist-left",
    "shoulder-right",
    "elbow-right",
    "wrist-right",
    "hip-left",
    "knee-left",
    "ankle-left",
    "hip-right",
    "knee-right",
    "ankle-right"
  ],
  "animationTargets": [
    { "targetId": "root", "partId": "root" },
    { "targetId": "pelvis", "partId": "pelvis" },
    { "targetId": "torso", "partId": "torso" },
    { "targetId": "head", "partId": "head" },
    { "targetId": "shoulder-left", "partId": "upper-arm-left" },
    { "targetId": "elbow-left", "partId": "lower-arm-left" },
    { "targetId": "wrist-left", "partId": "hand-left" },
    { "targetId": "shoulder-right", "partId": "upper-arm-right" },
    { "targetId": "elbow-right", "partId": "lower-arm-right" },
    { "targetId": "wrist-right", "partId": "hand-right" },
    { "targetId": "hip-left", "partId": "thigh-left" },
    { "targetId": "knee-left", "partId": "shin-left" },
    { "targetId": "ankle-left", "partId": "foot-left" },
    { "targetId": "hip-right", "partId": "thigh-right" },
    { "targetId": "knee-right", "partId": "shin-right" },
    { "targetId": "ankle-right", "partId": "foot-right" }
  ]
}
